,title_x,artist_x,year_x,key,url,WeekID,Week Position,Song,Performer,SongID,Instance,Previous Week Position,Peak Position,Weeks on Chart,Lyrics,Artist,words,wordCount,languages,all_words,allWordCount,year_y,decade,MTLD,TTR,CTTR,sentimentScore,sentimentScore_pos,sentimentScore_neg,emo_words,emoWordCount,joy,joy_normalized,sadness,sadness_normalized,anger,anger_normalized,disgust,disgust_normalized,trust,trust_normalized,anticipation,anticipation_normalized,fear,fear_normalized,surprise,surprise_normalized,emo_score,happy,happy_normalized,sorrow,sorrow_normalized,year,lower_title,title_y,artist_y,chartmetric_id,name,artist_country,pronoun,gender,is_band,genre,tokens,processed_tokens,topic,unique_tokens,tokens_list,set_size,lang
0,stagger lee,lloyd price,1959,stagger leelloyd price,http://www.billboard.com/charts/hot-100/1959-02-07,2/7/1959,1.0,stagger lee,lloyd price,stagger leelloyd price,1.0,5.0,1.0,10.0,"the night was clear
and the moon was yellow
and the leaves came tumbling down

i was standing on the corner
when i heard my bulldog bark
he was barking at the two men
who were gambling in the dark

it was stagger lee and billy
two men who gambled late
stagger lee threw seven
billy swore that he threw eight

stagger lee told billy
i can't let you go with that
you have won all my money
and my brand new stetson hat

stagger lee started off
goin down that railroad track
he said i can't get you billy
but don't be here when i come back

go on stagger lee

stagger lee went home
and he got his 44
said i'm going to the bar room
just to pay that debt i owe

stagger lee went to the bar room
and he stood across the bar room door
said now nobody move
and he pulled his 44

stagger lee cried billy
oh please don't take my life
i got three little children
and a very sickly wife

stagger lee shot billy
oh he shot that poor boy so bad
till the bullet came through billy
and it broke the bartender's glass

now look out stagg come on",lloyd price,"['night', 'clear', 'moon', 'yellow', 'leaf', 'come', 'tumble', 'stand', 'corner', 'heard', 'bulldog', 'bark', 'barking', 'two', 'men', 'gamble', 'dark', 'stagger', 'lee', 'billy', 'late', 'threw', 'seven', 'swore', 'eight', 'told', 'cant', 'let', 'go', 'money', 'brand', 'new', 'stetson', 'hat', 'start', 'goin', 'railroad', 'track', 'say', 'get', 'back', 'home', '44', 'im', 'bar', 'room', 'pay', 'debt', 'owe', 'stood', 'across', 'door', 'nobody', 'move', 'pull', 'cry', 'oh', 'please', 'take', 'life', 'three', 'little', 'child', 'sickly', 'wife', 'shot', 'poor', 'boy', 'bad', 'till', 'bullet', 'broke', 'bartender', 'glass', 'look', 'stagg']",76.0,en,"['night', 'clear', 'moon', 'yellow', 'leaf', 'come', 'tumble', 'stand', 'corner', 'heard', 'bulldog', 'bark', 'barking', 'two', 'men', 'gamble', 'dark', 'stagger', 'lee', 'billy', 'two', 'men', 'gamble', 'late', 'stagger', 'lee', 'threw', 'seven', 'billy', 'swore', 'threw', 'eight', 'stagger', 'lee', 'told', 'billy', 'cant', 'let', 'go', 'money', 'brand', 'new', 'stetson', 'hat', 'stagger', 'lee', 'start', 'goin', 'railroad', 'track', 'say', 'cant', 'get', 'billy', 'come', 'back', 'go', 'stagger', 'lee', 'stagger', 'lee', 'go', 'home', 'get', '44', 'say', 'im', 'go', 'bar', 'room', 'pay', 'debt', 'owe', 'stagger', 'lee', 'go', 'bar', 'room', 'stood', 'across', 'bar', 'room', 'door', 'say', 'nobody', 'move', 'pull', '44', 'stagger', 'lee', 'cry', 'billy', 'oh', 'please', 'take', 'life', 'get', 'three', 'little', 'child', 'sickly', 'wife', 'stagger', 'lee', 'shot', 'billy', 'oh', 'shot', 'poor', 'boy', 'bad', 'till', 'bullet', 'come', 'billy', 'broke', 'bartender', 'glass', 'look', 'stagg', 'come']",121.0,1959.0,50s,49.31854839,0.544600939,5.620218364,-0.945,0.032,0.097,"{'joy': 1.863, 'sadness': 5.242, 'anger': 2.236, 'surprise': 7.171, 'anticipation': 2.695, 'trust': 1.172, 'disgust': 1.125, 'fear': 2.281}",48.0,1.863,0.015396694,5.242,0.043322314,2.236,0.018479339,1.125,0.009297521,1.172,0.00968595,2.695,0.022272727,2.281,0.01885124,7.171,0.059264463,23.785,10.206,0.084347107,13.579,0.11222314,1959,stagger lee,Stagger Lee,lloyd price,242753.0,lloyd price,US,he/him,male,False,"{""rhythm and blues"",Rock,R&B/Soul,Pop,""adult standards"",""brill building pop"",doo-wop,""memphis blues"",""new orleans blues"",Rock,Blues,rock-and-roll,rockabilly,""memphis blues"",""louisiana blues"",""new orleans blues"",Pop,""rhythm and blues""}","['the', 'night', 'was', 'clear', 'and', 'the', 'moon', 'was', 'yellow', 'and', 'the', 'leaves', 'came', 'tumbling', 'down', 'i', 'was', 'standing', 'on', 'the', 'corner', 'when', 'i', 'heard', 'my', 'bulldog', 'bark', 'he', 'was', 'barking', 'at', 'the', 'two', 'men', 'who', 'were', 'gambling', 'in', 'the', 'dark', 'it', 'was', 'stagger', 'lee', 'and', 'billy', 'two', 'men', 'who', 'gambled', 'late', 'stagger', 'lee', 'threw', 'seven', 'billy', 'swore', 'that', 'he', 'threw', 'eight', 'stagger', 'lee', 'told', 'billy', 'i', 'can', 't', 'let', 'you', 'go', 'with', 'that', 'you', 'have', 'won', 'all', 'my', 'money', 'and', 'my', 'brand', 'new', 'stetson', 'hat', 'stagger', 'lee', 'started', 'off', 'goin', 'down', 'that', 'railroad', 'track', 'he', 'said', 'i', 'can', 't', 'get', 'you', 'billy', 'but', 'don', 't', 'be', 'here', 'when', 'i', 'come', 'back', 'go', 'on', 'stagger', 'lee', 'stagger', 'lee', 'went', 'home', 'and', 'he', 'got', 'his', '44', 'said', 'i', 'm', 'going', 'to', 'the', 'bar', 'room', 'just', 'to', 'pay', 'that', 'debt', 'i', 'owe', 'stagger', 'lee', 'went', 'to', 'the', 'bar', 'room', 'and', 'he', 'stood', 'across', 'the', 'bar', 'room', 'door', 'said', 'now', 'nobody', 'move', 'and', 'he', 'pulled', 'his', '44', 'stagger', 'lee', 'cried', 'billy', 'oh', 'please', 'don', 't', 'take', 'my', 'life', 'i', 'got', 'three', 'little', 'children', 'and', 'a', 'very', 'sickly', 'wife', 'stagger', 'lee', 'shot', 'billy', 'oh', 'he', 'shot', 'that', 'poor', 'boy', 'so', 'bad', 'till', 'the', 'bullet', 'came', 'through', 'billy', 'and', 'it', 'broke', 'the', 'bartender', 's', 'glass', 'now', 'look', 'out', 'stagg', 'come', 'on']","['night', 'clear', 'moon', 'yellow', 'leaf', 'came', 'tumbling', 'standing', 'corner', 'heard', 'bulldog', 'bark', 'barking', 'two', 'men', 'gambling', 'dark', 'stagger', 'lee', 'billy', 'two', 'men', 'gambled', 'late', 'stagger', 'lee', 'threw', 'seven', 'billy', 'swore', 'threw', 'eight', 'stagger', 'lee', 'told', 'billy', 'let', 'money', 'brand', 'new', 'stetson', 'hat', 'stagger', 'lee', 'started', 'goin', 'railroad', 'track', 'said', 'get', 'billy', 'come', 'back', 'stagger', 'lee', 'stagger', 'lee', 'went', 'home', 'got', 'said', 'going', 'bar', 'room', 'pay', 'debt', 'owe', 'stagger', 'lee', 'went', 'bar', 'room', 'stood', 'across', 'bar', 'room', 'door', 'said', 'nobody', 'move', 'pulled', 'stagger', 'lee', 'cried', 'billy', 'please', 'take', 'life', 'got', 'three', 'little', 'child', 'sickly', 'wife', 'stagger', 'lee', 'shot', 'billy', 'shot', 'poor', 'boy', 'bad', 'till', 'bullet', 'came', 'billy', 'broke', 'bartender', 'glass', 'look', 'stagg', 'come']",1,"{""'said'"", ""'come'"", ""'child'"", ""'goin'"", ""'wife'"", ""'standing'"", ""'till'"", ""'bartender'"", ""'stagger'"", ""'told'"", ""'little'"", ""'life'"", ""'heard'"", ""'back'"", ""'leaf'"", ""'bulldog'"", ""'room'"", ""'sickly'"", ""'bullet'"", ""'boy'"", ""'owe'"", ""'two'"", ""'cried'"", ""'seven'"", ""'started'"", ""'take'"", ""'get'"", ""'barking'"", ""'tumbling'"", ""'went'"", ""'threw'"", ""'gambled'"", ""'lee'"", ""'swore'"", ""'brand'"", ""'corner'"", ""'bad'"", ""'yellow'"", ""'night'"", ""'money'"", ""'billy'"", ""'stetson'"", ""'new'"", ""'moon'"", ""'got'"", ""'bar'"", ""'stagg'"", ""'gambling'"", ""'railroad'"", ""'let'"", ""'nobody'"", ""'three'"", ""'eight'"", ""'pay'"", ""'poor'"", ""'door'"", ""'hat'"", ""'going'"", ""'stood'"", ""'across'"", ""'move'"", ""'broke'"", ""'glass'"", ""'home'"", ""'track'"", ""'pulled'"", ""'debt'"", ""'look'"", ""'came'"", ""'bark'"", ""'shot'"", ""'please'"", ""'late'"", ""'men'"", ""'dark'"", ""'clear'""}","[""'night'"", ""'clear'"", ""'moon'"", ""'yellow'"", ""'leaf'"", ""'came'"", ""'tumbling'"", ""'standing'"", ""'corner'"", ""'heard'"", ""'bulldog'"", ""'bark'"", ""'barking'"", ""'two'"", ""'men'"", ""'gambling'"", ""'dark'"", ""'stagger'"", ""'lee'"", ""'billy'"", ""'two'"", ""'men'"", ""'gambled'"", ""'late'"", ""'stagger'"", ""'lee'"", ""'threw'"", ""'seven'"", ""'billy'"", ""'swore'"", ""'threw'"", ""'eight'"", ""'stagger'"", ""'lee'"", ""'told'"", ""'billy'"", ""'let'"", ""'money'"", ""'brand'"", ""'new'"", ""'stetson'"", ""'hat'"", ""'stagger'"", ""'lee'"", ""'started'"", ""'goin'"", ""'railroad'"", ""'track'"", ""'said'"", ""'get'"", ""'billy'"", ""'come'"", ""'back'"", ""'stagger'"", ""'lee'"", ""'stagger'"", ""'lee'"", ""'went'"", ""'home'"", ""'got'"", ""'said'"", ""'going'"", ""'bar'"", ""'room'"", ""'pay'"", ""'debt'"", ""'owe'"", ""'stagger'"", ""'lee'"", ""'went'"", ""'bar'"", ""'room'"", ""'stood'"", ""'across'"", ""'bar'"", ""'room'"", ""'door'"", ""'said'"", ""'nobody'"", ""'move'"", ""'pulled'"", ""'stagger'"", ""'lee'"", ""'cried'"", ""'billy'"", ""'please'"", ""'take'"", ""'life'"", ""'got'"", ""'three'"", ""'little'"", ""'child'"", ""'sickly'"", ""'wife'"", ""'stagger'"", ""'lee'"", ""'shot'"", ""'billy'"", ""'shot'"", ""'poor'"", ""'boy'"", ""'bad'"", ""'till'"", ""'bullet'"", ""'came'"", ""'billy'"", ""'broke'"", ""'bartender'"", ""'glass'"", ""'look'"", ""'stagg'"", ""'come'""]",76,en
1,the battle of new orleans,johnny horton,1959,the battle of new orleansjohnny horton,http://www.billboard.com/charts/hot-100/1959-06-27,6/27/1959,1.0,the battle of new orleans,johnny horton,the battle of new orleansjohnny horton,1.0,1.0,1.0,10.0,"in 84 we took a little trip
along with colonel jackson down the mighty mississip
we took a little bacon and we took a little beans
and we caught the bloody british in a town near new orleans


we fired our guns and the british kept acomin'
there wasn't nigh as many as there was a while ago
we fired once more and they begin to runnin'
on down the mississippi to the gulf of mexico


we looked down a river
huttwo
and we see'd the british come
threefour
and there must have been a hundred of'em
huttwo
beatin' on the drums
threefour
they stepped so high
huttwo
and they made their bugles ring
threefour
we stood beside our cotton bales
huttwo
and didn't say a thing
twothreefour


we fired our guns and the british kept acomin'
there wasn't nigh as many as there was a while ago
we fired once more and they begin to runnin'
on down the mississippi to the gulf of mexico


old hickory said we could take 'em by surprise
onehut twothreefour
if we didn't fire our muskets
onehut twothreefour
'till we looked 'em in the eye
onehut twothreefour
we held our fire
hut twothreefour
'till we see their faces well
then we opened up our squirrel guns
and really gave 'em  well we


fired our guns and the british kept acomin'
there wasn't nigh as many as there was a while ago
we fired once more and they begin to runnin'
on down the mississippi to the gulf of mexico

4
yeah they ran through the briars
onehuptwo
and they ran through the brambles
huptwothreefour
and they ran through the bushes
huptwo
where the rabbit couldn't go
huptwothreefour
they ran so fast
huptwo
that the hounds couldn't catch 'em
onetwothreefour
on down the mississippi to the gulf of mexico
onetwo huptwothreefour

5
we fired our cannon 'til the barrel melted down
so we grabbed an alligator and we fired another round
we filled his head with cannon balls and powdered his behind
and when we touched the powder off the gator lost his mind


we fired our guns and the british kept acomin'
there wasn't nigh as many as there was a while ago
we fired once more and they begin to runnin'
on down the mississippi to the gulf of mexico

4
yeah they ran through the briars
huponetwo
and they ran through the brambles
onetwothreefour
and they ran through the bushes
huptwo
where the rabbit couldn't go
huptwothreefour
they ran so fast
huptwo
that the hounds couldn't catch 'em
onetwothreefour
on down the mississippi to the gulf of mexico",johnny horton,"['84', 'take', 'little', 'trip', 'along', 'colonel', 'jackson', 'mighty', 'mississip', 'bacon', 'bean', 'caught', 'bloody', 'british', 'town', 'near', 'new', 'orleans', 'fire', 'gun', 'kept', 'acomin', 'nigh', 'many', 'ago', 'begin', 'runnin', 'mississippi', 'gulf', 'mexico', 'look', 'river', 'huttwo', 'seed', 'come', 'threefour', 'must', 'hundred', 'ofem', 'beatin', 'drum', 'step', 'high', 'make', 'bugle', 'ring', 'stood', 'beside', 'cotton', 'bale', 'say', 'thing', 'twothreefour', 'old', 'hickory', 'could', 'em', 'surprise', 'onehut', 'musket', 'till', 'eye', 'held', 'hut', 'see', 'face', 'well', 'open', 'squirrel', 'really', 'give', '4', 'yeah', 'ran', 'briar', 'onehuptwo', 'bramble', 'huptwothreefour', 'bush', 'huptwo', 'rabbit', 'go', 'fast', 'hound', 'catch', 'onetwothreefour', 'onetwo', '5', 'cannon', 'til', 'barrel', 'melt', 'grabbed', 'alligator', 'another', 'round', 'fill', 'head', 'ball', 'powder', 'behind', 'touch', 'gator', 'lose', 'mind', 'huponetwo']",106.0,en,"['84', 'take', 'little', 'trip', 'along', 'colonel', 'jackson', 'mighty', 'mississip', 'take', 'little', 'bacon', 'take', 'little', 'bean', 'caught', 'bloody', 'british', 'town', 'near', 'new', 'orleans', 'fire', 'gun', 'british', 'kept', 'acomin', 'nigh', 'many', 'ago', 'fire', 'begin', 'runnin', 'mississippi', 'gulf', 'mexico', 'look', 'river', 'huttwo', 'seed', 'british', 'come', 'threefour', 'must', 'hundred', 'ofem', 'huttwo', 'beatin', 'drum', 'threefour', 'step', 'high', 'huttwo', 'make', 'bugle', 'ring', 'threefour', 'stood', 'beside', 'cotton', 'bale', 'huttwo', 'say', 'thing', 'twothreefour', 'fire', 'gun', 'british', 'kept', 'acomin', 'nigh', 'many', 'ago', 'fire', 'begin', 'runnin', 'mississippi', 'gulf', 'mexico', 'old', 'hickory', 'say', 'could', 'take', 'em', 'surprise', 'onehut', 'twothreefour', 'fire', 'musket', 'onehut', 'twothreefour', 'till', 'look', 'em', 'eye', 'onehut', 'twothreefour', 'held', 'fire', 'hut', 'twothreefour', 'till', 'see', 'face', 'well', 'open', 'squirrel', 'gun', 'really', 'give', 'em', 'well', 'fire', 'gun', 'british', 'kept', 'acomin', 'nigh', 'many', 'ago', 'fire', 'begin', 'runnin', 'mississippi', 'gulf', 'mexico', '4', 'yeah', 'ran', 'briar', 'onehuptwo', 'ran', 'bramble', 'huptwothreefour', 'ran', 'bush', 'huptwo', 'rabbit', 'go', 'huptwothreefour', 'ran', 'fast', 'huptwo', 'hound', 'catch', 'em', 'onetwothreefour', 'mississippi', 'gulf', 'mexico', 'onetwo', 'huptwothreefour', '5', 'fire', 'cannon', 'til', 'barrel', 'melt', 'grabbed', 'alligator', 'fire', 'another', 'round', 'fill', 'head', 'cannon', 'ball', 'powder', 'behind', 'touch', 'powder', 'gator', 'lose', 'mind', 'fire', 'gun', 'british', 'kept', 'acomin', 'nigh', 'many', 'ago', 'fire', 'begin', 'runnin', 'mississippi', 'gulf', 'mexico', '4', 'yeah', 'ran', 'briar', 'huponetwo', 'ran', 'bramble', 'onetwothreefour', 'ran', 'bush', 'huptwo', 'rabbit', 'go', 'huptwothreefour', 'ran', 'fast', 'huptwo', 'hound', 'catch', 'em', 'onetwothreefour', 'mississippi', 'gulf', 'mexico']",213.0,1959.0,50s,48.72260147,0.321348315,4.793370891,-0.9841,0.032,0.09,"{'surprise': 1.594, 'trust': 1.273, 'anger': 4.844, 'fear': 14.331000000000001, 'joy': 1.0, 'disgust': 0.891, 'sadness': 1.674, 'anticipation': 0.312}",53.0,1.0,0.004694836,1.674,0.007859155,4.844,0.022741784,0.891,0.004183099,1.273,0.005976526,0.312,0.001464789,14.331,0.06728169,1.594,0.007483568,25.919,3.867,0.01815493,22.052,0.103530516,1959,the battle of new orleans,The Battle Of New Orleans,johnny horton,106452.0,johnny horton,US,he/him,male,False,"{rock-and-roll,rockabilly,""Honky Tonk"",""cowboy western"",Country,Rockabilly,Rock,""cowboy western"",""Traditional Country"",Country,rock-and-roll}","['in', '84', 'we', 'took', 'a', 'little', 'trip', 'along', 'with', 'colonel', 'jackson', 'down', 'the', 'mighty', 'mississip', 'we', 'took', 'a', 'little', 'bacon', 'and', 'we', 'took', 'a', 'little', 'beans', 'and', 'we', 'caught', 'the', 'bloody', 'british', 'in', 'a', 'town', 'near', 'new', 'orleans', 'we', 'fired', 'our', 'guns', 'and', 'the', 'british', 'kept', 'acomin', 'there', 'wasn', 't', 'nigh', 'as', 'many', 'as', 'there', 'was', 'a', 'while', 'ago', 'we', 'fired', 'once', 'more', 'and', 'they', 'begin', 'to', 'runnin', 'on', 'down', 'the', 'mississippi', 'to', 'the', 'gulf', 'of', 'mexico', 'we', 'looked', 'down', 'a', 'river', 'huttwo', 'and', 'we', 'see', 'd', 'the', 'british', 'come', 'threefour', 'and', 'there', 'must', 'have', 'been', 'a', 'hundred', 'of', 'em', 'huttwo', 'beatin', 'on', 'the', 'drums', 'threefour', 'they', 'stepped', 'so', 'high', 'huttwo', 'and', 'they', 'made', 'their', 'bugles', 'ring', 'threefour', 'we', 'stood', 'beside', 'our', 'cotton', 'bales', 'huttwo', 'and', 'didn', 't', 'say', 'a', 'thing', 'twothreefour', 'we', 'fired', 'our', 'guns', 'and', 'the', 'british', 'kept', 'acomin', 'there', 'wasn', 't', 'nigh', 'as', 'many', 'as', 'there', 'was', 'a', 'while', 'ago', 'we', 'fired', 'once', 'more', 'and', 'they', 'begin', 'to', 'runnin', 'on', 'down', 'the', 'mississippi', 'to', 'the', 'gulf', 'of', 'mexico', 'old', 'hickory', 'said', 'we', 'could', 'take', 'em', 'by', 'surprise', 'onehut', 'twothreefour', 'if', 'we', 'didn', 't', 'fire', 'our', 'muskets', 'onehut', 'twothreefour', 'till', 'we', 'looked', 'em', 'in', 'the', 'eye', 'onehut', 'twothreefour', 'we', 'held', 'our', 'fire', 'hut', 'twothreefour', 'till', 'we', 'see', 'their', 'faces', 'well', 'then', 'we', 'opened', 'up', 'our', 'squirrel', 'guns', 'and', 'really', 'gave', 'em', 'well', 'we', 'fired', 'our', 'guns', 'and', 'the', 'british', 'kept', 'acomin', 'there', 'wasn', 't', 'nigh', 'as', 'many', 'as', 'there', 'was', 'a', 'while', 'ago', 'we', 'fired', 'once', 'more', 'and', 'they', 'begin', 'to', 'runnin', 'on', 'down', 'the', 'mississippi', 'to', 'the', 'gulf', 'of', 'mexico', '4', 'yeah', 'they', 'ran', 'through', 'the', 'briars', 'onehuptwo', 'and', 'they', 'ran', 'through', 'the', 'brambles', 'huptwothreefour', 'and', 'they', 'ran', 'through', 'the', 'bushes', 'huptwo', 'where', 'the', 'rabbit', 'couldn', 't', 'go', 'huptwothreefour', 'they', 'ran', 'so', 'fast', 'huptwo', 'that', 'the', 'hounds', 'couldn', 't', 'catch', 'em', 'onetwothreefour', 'on', 'down', 'the', 'mississippi', 'to', 'the', 'gulf', 'of', 'mexico', 'onetwo', 'huptwothreefour', '5', 'we', 'fired', 'our', 'cannon', 'til', 'the', 'barrel', 'melted', 'down', 'so', 'we', 'grabbed', 'an', 'alligator', 'and', 'we', 'fired', 'another', 'round', 'we', 'filled', 'his', 'head', 'with', 'cannon', 'balls', 'and', 'powdered', 'his', 'behind', 'and', 'when', 'we', 'touched', 'the', 'powder', 'off', 'the', 'gator', 'lost', 'his', 'mind', 'we', 'fired', 'our', 'guns', 'and', 'the', 'british', 'kept', 'acomin', 'there', 'wasn', 't', 'nigh', 'as', 'many', 'as', 'there', 'was', 'a', 'while', 'ago', 'we', 'fired', 'once', 'more', 'and', 'they', 'begin', 'to', 'runnin', 'on', 'down', 'the', 'mississippi', 'to', 'the', 'gulf', 'of', 'mexico', '4', 'yeah', 'they', 'ran', 'through', 'the', 'briars', 'huponetwo', 'and', 'they', 'ran', 'through', 'the', 'brambles', 'onetwothreefour', 'and', 'they', 'ran', 'through', 'the', 'bushes', 'huptwo', 'where', 'the', 'rabbit', 'couldn', 't', 'go', 'huptwothreefour', 'they', 'ran', 'so', 'fast', 'huptwo', 'that', 'the', 'hounds', 'couldn', 't', 'catch', 'em', 'onetwothreefour', 'on', 'down', 'the', 'mississippi', 'to', 'the', 'gulf', 'of', 'mexico']","['took', 'little', 'trip', 'along', 'colonel', 'jackson', 'mighty', 'mississip', 'took', 'little', 'bacon', 'took', 'little', 'bean', 'caught', 'bloody', 'british', 'town', 'near', 'new', 'orleans', 'fired', 'gun', 'british', 'kept', 'acomin', 'nigh', 'many', 'ago', 'fired', 'begin', 'runnin', 'mississippi', 'gulf', 'mexico', 'looked', 'river', 'huttwo', 'see', 'british', 'come', 'threefour', 'must', 'hundred', 'huttwo', 'beatin', 'drum', 'threefour', 'stepped', 'high', 'huttwo', 'made', 'bugle', 'ring', 'threefour', 'stood', 'beside', 'cotton', 'bale', 'huttwo', 'say', 'thing', 'twothreefour', 'fired', 'gun', 'british', 'kept', 'acomin', 'nigh', 'many', 'ago', 'fired', 'begin', 'runnin', 'mississippi', 'gulf', 'mexico', 'old', 'hickory', 'said', 'could', 'take', 'surprise', 'onehut', 'twothreefour', 'fire', 'musket', 'onehut', 'twothreefour', 'till', 'looked', 'eye', 'onehut', 'twothreefour', 'held', 'fire', 'hut', 'twothreefour', 'till', 'see', 'face', 'well', 'opened', 'squirrel', 'gun', 'really', 'gave', 'well', 'fired', 'gun', 'british', 'kept', 'acomin', 'nigh', 'many', 'ago', 'fired', 'begin', 'runnin', 'mississippi', 'gulf', 'mexico', 'yeah', 'ran', 'briar', 'onehuptwo', 'ran', 'bramble', 'huptwothreefour', 'ran', 'bush', 'huptwo', 'rabbit', 'huptwothreefour', 'ran', 'fast', 'huptwo', 'hound', 'catch', 'onetwothreefour', 'mississippi', 'gulf', 'mexico', 'onetwo', 'huptwothreefour', 'fired', 'cannon', 'til', 'barrel', 'melted', 'grabbed', 'alligator', 'fired', 'another', 'round', 'filled', 'head', 'cannon', 'ball', 'powdered', 'behind', 'touched', 'powder', 'gator', 'lost', 'mind', 'fired', 'gun', 'british', 'kept', 'acomin', 'nigh', 'many', 'ago', 'fired', 'begin', 'runnin', 'mississippi', 'gulf', 'mexico', 'yeah', 'ran', 'briar', 'huponetwo', 'ran', 'bramble', 'onetwothreefour', 'ran', 'bush', 'huptwo', 'rabbit', 'huptwothreefour', 'ran', 'fast', 'huptwo', 'hound', 'catch', 'onetwothreefour', 'mississippi', 'gulf', 'mexico']",4,"{""'stepped'"", ""'powder'"", ""'barrel'"", ""'runnin'"", ""'surprise'"", ""'bale'"", ""'acomin'"", ""'onehut'"", ""'mighty'"", ""'trip'"", ""'begin'"", ""'mexico'"", ""'new'"", ""'took'"", ""'nigh'"", ""'ball'"", ""'drum'"", ""'bramble'"", ""'bugle'"", ""'stood'"", ""'fired'"", ""'bloody'"", ""'eye'"", ""'ago'"", ""'said'"", ""'touched'"", ""'behind'"", ""'gun'"", ""'really'"", ""'could'"", ""'huponetwo'"", ""'filled'"", ""'mississippi'"", ""'hundred'"", ""'face'"", ""'onetwothreefour'"", ""'caught'"", ""'gulf'"", ""'catch'"", ""'say'"", ""'hut'"", ""'hound'"", ""'high'"", ""'ran'"", ""'jackson'"", ""'looked'"", ""'mind'"", ""'melted'"", ""'held'"", ""'onehuptwo'"", ""'thing'"", ""'many'"", ""'come'"", ""'rabbit'"", ""'onetwo'"", ""'little'"", ""'river'"", ""'cotton'"", ""'opened'"", ""'bacon'"", ""'briar'"", ""'beside'"", ""'threefour'"", ""'alligator'"", ""'gave'"", ""'hickory'"", ""'colonel'"", ""'fast'"", ""'town'"", ""'near'"", ""'mississip'"", ""'yeah'"", ""'bean'"", ""'another'"", ""'orleans'"", ""'twothreefour'"", ""'ring'"", ""'along'"", ""'round'"", ""'grabbed'"", ""'huttwo'"", ""'huptwothreefour'"", ""'beatin'"", ""'till'"", ""'squirrel'"", ""'musket'"", ""'bush'"", ""'take'"", ""'fire'"", ""'old'"", ""'cannon'"", ""'see'"", ""'kept'"", ""'british'"", ""'well'"", ""'huptwo'"", ""'til'"", ""'gator'"", ""'head'"", ""'must'"", ""'lost'"", ""'made'"", ""'powdered'""}","[""'took'"", ""'little'"", ""'trip'"", ""'along'"", ""'colonel'"", ""'jackson'"", ""'mighty'"", ""'mississip'"", ""'took'"", ""'little'"", ""'bacon'"", ""'took'"", ""'little'"", ""'bean'"", ""'caught'"", ""'bloody'"", ""'british'"", ""'town'"", ""'near'"", ""'new'"", ""'orleans'"", ""'fired'"", ""'gun'"", ""'british'"", ""'kept'"", ""'acomin'"", ""'nigh'"", ""'many'"", ""'ago'"", ""'fired'"", ""'begin'"", ""'runnin'"", ""'mississippi'"", ""'gulf'"", ""'mexico'"", ""'looked'"", ""'river'"", ""'huttwo'"", ""'see'"", ""'british'"", ""'come'"", ""'threefour'"", ""'must'"", ""'hundred'"", ""'huttwo'"", ""'beatin'"", ""'drum'"", ""'threefour'"", ""'stepped'"", ""'high'"", ""'huttwo'"", ""'made'"", ""'bugle'"", ""'ring'"", ""'threefour'"", ""'stood'"", ""'beside'"", ""'cotton'"", ""'bale'"", ""'huttwo'"", ""'say'"", ""'thing'"", ""'twothreefour'"", ""'fired'"", ""'gun'"", ""'british'"", ""'kept'"", ""'acomin'"", ""'nigh'"", ""'many'"", ""'ago'"", ""'fired'"", ""'begin'"", ""'runnin'"", ""'mississippi'"", ""'gulf'"", ""'mexico'"", ""'old'"", ""'hickory'"", ""'said'"", ""'could'"", ""'take'"", ""'surprise'"", ""'onehut'"", ""'twothreefour'"", ""'fire'"", ""'musket'"", ""'onehut'"", ""'twothreefour'"", ""'till'"", ""'looked'"", ""'eye'"", ""'onehut'"", ""'twothreefour'"", ""'held'"", ""'fire'"", ""'hut'"", ""'twothreefour'"", ""'till'"", ""'see'"", ""'face'"", ""'well'"", ""'opened'"", ""'squirrel'"", ""'gun'"", ""'really'"", ""'gave'"", ""'well'"", ""'fired'"", ""'gun'"", ""'british'"", ""'kept'"", ""'acomin'"", ""'nigh'"", ""'many'"", ""'ago'"", ""'fired'"", ""'begin'"", ""'runnin'"", ""'mississippi'"", ""'gulf'"", ""'mexico'"", ""'yeah'"", ""'ran'"", ""'briar'"", ""'onehuptwo'"", ""'ran'"", ""'bramble'"", ""'huptwothreefour'"", ""'ran'"", ""'bush'"", ""'huptwo'"", ""'rabbit'"", ""'huptwothreefour'"", ""'ran'"", ""'fast'"", ""'huptwo'"", ""'hound'"", ""'catch'"", ""'onetwothreefour'"", ""'mississippi'"", ""'gulf'"", ""'mexico'"", ""'onetwo'"", ""'huptwothreefour'"", ""'fired'"", ""'cannon'"", ""'til'"", ""'barrel'"", ""'melted'"", ""'grabbed'"", ""'alligator'"", ""'fired'"", ""'another'"", ""'round'"", ""'filled'"", ""'head'"", ""'cannon'"", ""'ball'"", ""'powdered'"", ""'behind'"", ""'touched'"", ""'powder'"", ""'gator'"", ""'lost'"", ""'mind'"", ""'fired'"", ""'gun'"", ""'british'"", ""'kept'"", ""'acomin'"", ""'nigh'"", ""'many'"", ""'ago'"", ""'fired'"", ""'begin'"", ""'runnin'"", ""'mississippi'"", ""'gulf'"", ""'mexico'"", ""'yeah'"", ""'ran'"", ""'briar'"", ""'huponetwo'"", ""'ran'"", ""'bramble'"", ""'onetwothreefour'"", ""'ran'"", ""'bush'"", ""'huptwo'"", ""'rabbit'"", ""'huptwothreefour'"", ""'ran'"", ""'fast'"", ""'huptwo'"", ""'hound'"", ""'catch'"", ""'onetwothreefour'"", ""'mississippi'"", ""'gulf'"", ""'mexico'""]",103,en
